{
  "forecastId": "f-yeongjong-2025",
  "sessionId": "s-demo-0001",
  "publishedAt": "2026-09-24T20:00:15+09:00",
  "revision": 7,
  "masterVersion": 1,
  "event": {
    "id": "e-yeongjong-fireworks-2025",
    "name": "영종 씨사이드파크 불꽃축제",
    "type": "불꽃",
    "startsAt": "2025-10-18T19:00:00+09:00",
    "endsAt": "2025-10-18T21:00:00+09:00",
    "timeOfDay": "야간",
    "venue": {
      "name": "영종 씨사이드파크",
      "lat": 37.49,
      "lng": 126.58
    },
    "sido": "인천광역시",
    "sigunguCode": "28110",
    "sigunguName": "인천 중구",
    "fee": "무료",
    "hostType": "지자체",
    "budgetKrw": null,
    "edition": null,
    "promo": [
      "인스타그램",
      "유튜브"
    ],
    "hazards": [
      "폭죽"
    ],
    "expectedByHost": {
      "id": "q-e-yeongjong-host",
      "name": "주최측 예상",
      "value": 2000,
      "p10": null,
      "p50": null,
      "p90": null,
      "unit": "명",
      "timeUnit": "기간누적",
      "spatialScope": "행사장",
      "valueKind": "사전예상",
      "estimated": false,
      "assumptionIds": [],
      "announcedAt": "2025-10-10"
    },
    "source": "사용자입력"
  },
  "card": {
    "id": "f-yeongjong-2025",
    "eventId": "e-yeongjong-fireworks-2025",
    "asOf": "2025-10-04",
    "modelVersion": "v0.1.0",
    "dailyMean": {
      "id": "q-f-yeongjong-2025-mean",
      "name": "일평균 방문객",
      "p10": 7400,
      "p50": 13000,
      "p90": 22000,
      "unit": "명/일",
      "timeUnit": "일",
      "estimated": false,
      "assumptionIds": [],
      "value": null,
      "spatialScope": "행사장",
      "valueKind": "예측",
      "announcedAt": null
    },
    "peakConcurrent": {
      "id": "q-f-yeongjong-2025-peak",
      "name": "순간 최대",
      "p10": 12000,
      "p50": 21000,
      "p90": 35000,
      "unit": "명",
      "timeUnit": "순간",
      "estimated": true,
      "assumptionIds": [
        "as-peak-day-factor",
        "as-concurrency-fireworks"
      ],
      "value": null,
      "spatialScope": "행사장",
      "valueKind": "예측",
      "announcedAt": null
    },
    "probabilities": [
      {
        "threshold": 1000,
        "probability": 0.99,
        "display": "99%"
      },
      {
        "threshold": 5000,
        "probability": 0.9,
        "display": "90%"
      }
    ],
    "peakHours": {
      "from": "19:00",
      "to": "21:00"
    },
    "ood": false,
    "oodReasons": [],
    "judgment": {
      "level": 4,
      "label": "대규모",
      "reasons": [
        {
          "ruleId": "rule-legal-hazard",
          "kind": "법정",
          "text": "폭죽 사용 — 법정 기준(인원 무관)"
        },
        {
          "ruleId": "rule-internal-5000",
          "kind": "자체",
          "text": "5,000명 초과 90% — 자체 기준"
        }
      ]
    }
  },
  "forecast": {
    "id": "f-yeongjong-2025",
    "eventId": "e-yeongjong-fireworks-2025",
    "asOf": "2025-10-04",
    "createdAt": "2026-09-24T20:00:00+09:00",
    "modelVersion": "v0.1.0",
    "dailyMean": {
      "id": "q-f-yeongjong-2025-mean",
      "name": "일평균 방문객",
      "p10": 7400,
      "p50": 13000,
      "p90": 22000,
      "unit": "명/일",
      "timeUnit": "일",
      "estimated": false,
      "assumptionIds": [],
      "value": null,
      "spatialScope": "행사장",
      "valueKind": "예측",
      "announcedAt": null
    },
    "peakConcurrent": {
      "id": "q-f-yeongjong-2025-peak",
      "name": "순간 최대",
      "p10": 12000,
      "p50": 21000,
      "p90": 35000,
      "unit": "명",
      "timeUnit": "순간",
      "estimated": true,
      "assumptionIds": [
        "as-peak-day-factor",
        "as-concurrency-fireworks"
      ],
      "value": null,
      "spatialScope": "행사장",
      "valueKind": "예측",
      "announcedAt": null
    },
    "probabilities": [
      {
        "threshold": 1000,
        "probability": 0.99,
        "display": "99%"
      },
      {
        "threshold": 5000,
        "probability": 0.9,
        "display": "90%"
      }
    ],
    "peakHours": {
      "from": "19:00",
      "to": "21:00"
    },
    "hourlyProfile": [
      {
        "hour": 17,
        "share": 0.1
      },
      {
        "hour": 18,
        "share": 0.2
      },
      {
        "hour": 19,
        "share": 0.35
      },
      {
        "hour": 20,
        "share": 0.25
      },
      {
        "hour": 21,
        "share": 0.1
      }
    ],
    "composition": null,
    "judgment": {
      "level": 4,
      "label": "대규모",
      "ruleIds": [
        "rule-legal-hazard",
        "rule-internal-5000"
      ],
      "reasons": [
        {
          "ruleId": "rule-legal-hazard",
          "kind": "법정",
          "text": "폭죽 사용 — 법정 기준(인원 무관)",
          "clauseId": "law-disaster-act-enf-73-9",
          "evidenceId": "ev-rule-legal-hazard"
        },
        {
          "ruleId": "rule-internal-5000",
          "kind": "자체",
          "text": "5,000명 초과 90% — 자체 기준",
          "clauseId": null,
          "evidenceId": "ev-rule-internal-5000"
        }
      ],
      "checklist": [
        {
          "id": "ck-traffic",
          "text": "교통·주차 통제 계획과 경찰·소방 사전 협의",
          "ruleId": "rule-internal-5000",
          "evidenceIds": [
            "ev-rule-internal-5000"
          ]
        }
      ]
    },
    "factors": [
      {
        "id": "fa-night-weekend",
        "feature": "토요일·야간",
        "direction": "up",
        "contribution": 0.42,
        "label": "토요일 저녁 개최라 늘어요",
        "evidenceIds": [
          "ev-model-f-yeongjong-2025"
        ]
      }
    ],
    "ood": false,
    "oodReasons": [],
    "predictionRun": {
      "id": "pr-f-yeongjong-2025",
      "modelRunId": "mr-v0-1-0",
      "modelVersion": "v0.1.0",
      "asOf": "2025-10-04",
      "observationIds": [
        "obs-28110-sat-nonlocal"
      ],
      "trainRange": {
        "from": "2018-01-01",
        "to": "2024-12-31"
      }
    },
    "observations": [
      {
        "id": "obs-28110-sat-nonlocal",
        "featureName": "평시 토요일 외지인",
        "value": 61000,
        "unit": "명/일",
        "datasetId": "ds-kto-visitors-15101972",
        "observedAt": "2025-09-27",
        "availableAt": "2025-10-01",
        "sigunguCode": "28110"
      }
    ],
    "assumptions": [
      {
        "id": "as-peak-day-factor",
        "name": "피크일 계수",
        "value": 1.0,
        "low": 0.8,
        "high": 1.2,
        "unit": "배",
        "basis": "가정",
        "note": "1일 행사"
      },
      {
        "id": "as-concurrency-fireworks",
        "name": "동시체류율(불꽃)",
        "value": 1.0,
        "low": 0.8,
        "high": 1.0,
        "unit": "비율",
        "basis": "가정",
        "note": "공연 시각에 대부분 머문다"
      }
    ],
    "evidence": [
      {
        "quantityIds": [],
        "period": {
          "from": "2025-09-06",
          "to": "2025-09-27"
        },
        "source": {
          "datasetId": "ds-kto-visitors-15101972",
          "title": "한국관광공사_빅데이터_지역별 방문자수_GW",
          "publisher": "한국관광공사",
          "datalabMenu": "빅데이터 > 지역별 방문자수(이동통신)",
          "accessUrl": "https://www.data.go.kr/data/15101972/openapi.do"
        },
        "availableAt": "2025-10-01",
        "ruleId": null,
        "clauseId": null,
        "caseEventId": null,
        "assumptionId": null,
        "forecastId": null,
        "modelVersion": null,
        "checkResult": null,
        "id": "ev-baseline-28110",
        "kind": "data",
        "title": "인천 중구 평시 토요일 방문",
        "summary": "행사 전 4주 같은 요일 평균"
      },
      {
        "quantityIds": [
          "q-f-yeongjong-2025-mean"
        ],
        "period": null,
        "source": null,
        "availableAt": null,
        "ruleId": null,
        "clauseId": null,
        "caseEventId": null,
        "assumptionId": null,
        "forecastId": "f-yeongjong-2025",
        "modelVersion": "v0.1.0",
        "checkResult": null,
        "id": "ev-model-f-yeongjong-2025",
        "kind": "model",
        "title": "예측 모델",
        "summary": "LightGBM 분위수 + CQR"
      },
      {
        "quantityIds": [],
        "period": null,
        "source": null,
        "availableAt": null,
        "ruleId": "rule-legal-hazard",
        "clauseId": "law-disaster-act-enf-73-9",
        "caseEventId": null,
        "assumptionId": null,
        "forecastId": null,
        "modelVersion": null,
        "checkResult": null,
        "id": "ev-rule-legal-hazard",
        "kind": "rule",
        "title": "인원 무관 대상(폭죽)",
        "summary": "불·폭죽 사용 행사는 인원과 관계없이 안전관리계획 수립 대상"
      },
      {
        "quantityIds": [],
        "period": null,
        "source": null,
        "availableAt": null,
        "ruleId": "rule-internal-5000",
        "clauseId": null,
        "caseEventId": null,
        "assumptionId": null,
        "forecastId": null,
        "modelVersion": null,
        "checkResult": null,
        "id": "ev-rule-internal-5000",
        "kind": "rule",
        "title": "대규모 기준(자체)",
        "summary": "순간 최대 5,000명 초과 확률 50% 이상이면 대규모"
      },
      {
        "quantityIds": [
          "q-f-yeongjong-2025-peak"
        ],
        "period": null,
        "source": null,
        "availableAt": null,
        "ruleId": null,
        "clauseId": null,
        "caseEventId": null,
        "assumptionId": "as-peak-day-factor",
        "forecastId": null,
        "modelVersion": null,
        "checkResult": null,
        "id": "ev-as-peak-day-factor",
        "kind": "assumption",
        "title": "피크일 계수",
        "summary": "1일 행사 1.0(범위 0.8~1.2, 가정)"
      },
      {
        "quantityIds": [
          "q-f-yeongjong-2025-peak"
        ],
        "period": null,
        "source": null,
        "availableAt": null,
        "ruleId": null,
        "clauseId": null,
        "caseEventId": null,
        "assumptionId": "as-concurrency-fireworks",
        "forecastId": null,
        "modelVersion": null,
        "checkResult": null,
        "id": "ev-as-concurrency-fireworks",
        "kind": "assumption",
        "title": "동시체류율(불꽃)",
        "summary": "불꽃 행사 동시체류율 1.0(범위 0.8~1.0, 가정)"
      }
    ]
  },
  "claims": [
    {
      "id": "c-yeongjong-3",
      "sessionId": "s-demo-0001",